{
  "$schema": "https://json-schema.org/draft/2020-12/schema",
  "$id": "https://kai.deerude.com/schemas/legal-domain-plugin.json",
  "title": "Legal Brain Domain Plugin Manifest",
  "description": "Manifest describing one jurisdiction plugin for the Legal Brain. Each domain is isolated: its DB, vector store, and knowledge graph are all its own — cross-domain queries go through a mediator.",
  "type": "object",
  "required": [
    "id",
    "name",
    "jurisdiction",
    "version",
    "db_path",
    "vector_store_path",
    "kg_path",
    "sources",
    "citation_style",
    "disclaimer",
    "data_privacy"
  ],
  "additionalProperties": false,
  "properties": {
    "id": {
      "type": "string",
      "description": "Kebab-case identifier, unique across all domain manifests.",
      "pattern": "^[a-z][a-z0-9]*(-[a-z0-9]+)*$",
      "minLength": 2,
      "maxLength": 64
    },
    "name": {
      "type": "string",
      "description": "Human-facing display name.",
      "minLength": 1,
      "maxLength": 200
    },
    "jurisdiction": {
      "type": "object",
      "description": "Jurisdiction the domain covers.",
      "required": ["country"],
      "additionalProperties": false,
      "properties": {
        "country": {
          "type": "string",
          "description": "ISO 3166-1 alpha-2 country code, uppercase.",
          "pattern": "^[A-Z]{2}$"
        },
        "subdivision": {
          "type": ["string", "null"],
          "description": "Optional ISO 3166-2 subdivision code (e.g. 'US-CA').",
          "pattern": "^[A-Z]{2}-[A-Z0-9]{1,3}$"
        }
      }
    },
    "version": {
      "type": "string",
      "description": "Semver-ish plugin version.",
      "pattern": "^[0-9]+\\.[0-9]+\\.[0-9]+(-[a-z0-9.]+)?$"
    },
    "enabled": {
      "type": "boolean",
      "description": "Default activation state on registry load. Operator can override via API. Default false — a manifest is disabled unless explicitly turned on.",
      "default": false
    },
    "db_path": {
      "type": "string",
      "description": "Filesystem path to this domain's exclusive SQL database. Never shared with another domain.",
      "minLength": 1
    },
    "vector_store_path": {
      "type": "string",
      "description": "Filesystem path (or 'unknown') to this domain's exclusive vector store directory.",
      "minLength": 1
    },
    "kg_path": {
      "type": "string",
      "description": "Filesystem path (or 'unknown') to this domain's exclusive knowledge graph store.",
      "minLength": 1
    },
    "sources": {
      "type": "array",
      "description": "Data sources the domain draws from. Empty is legal for stubs.",
      "items": {
        "type": "object",
        "required": ["url", "trust_score"],
        "additionalProperties": true,
        "properties": {
          "url": {"type": "string", "format": "uri"},
          "name": {"type": "string"},
          "trust_score": {
            "type": "number",
            "description": "0.0 (untrusted) .. 1.0 (authoritative government publisher).",
            "minimum": 0.0,
            "maximum": 1.0
          },
          "status": {
            "type": "string",
            "enum": ["permitted", "restricted", "unverified", "paywalled", "unreachable"]
          }
        }
      }
    },
    "citation_style": {
      "type": "string",
      "description": "Citation format hint (e.g. 'Ghana-Bluebook', 'AMA', 'APA-legal').",
      "minLength": 1
    },
    "disclaimer": {
      "type": "string",
      "description": "Long-form disclaimer shown before any answer. Never optional.",
      "minLength": 20
    },
    "data_privacy": {
      "type": "object",
      "description": "Privacy posture for this domain's storage.",
      "required": ["user_docs_stored", "permanent_corpus"],
      "additionalProperties": false,
      "properties": {
        "user_docs_stored": {
          "type": "boolean",
          "description": "Whether user-uploaded docs persist beyond the query."
        },
        "permanent_corpus": {
          "type": "boolean",
          "description": "Whether the domain retains a permanent, indexed corpus."
        },
        "retention_days": {
          "type": ["integer", "null"],
          "minimum": 0
        }
      }
    },
    "implementation_notes": {
      "type": "string",
      "description": "For stub manifests: what must still happen for the stub to become real."
    }
  }
}
